{
  "version": 1,
  "name": "PhoenixReffaellaOfficial",
  "canvas": [
    2347,
    1253
  ],
  "asset_root": "local-assets",
  "sources": {
    "base": "official-reference.png",
    "original": "official-reference.png",
    "leftwhite": "official-reference.png",
    "rightwhite": "official-reference.png",
    "skin": "artwork/official-rig/face-underlay-generated.png",
    "whiteplate": "artwork/official-rig/eye-whites-generated.png",
    "mask": "aperture-mask.png"
  },
  "source_overlays": [
    {
      "target": "base",
      "source": "skin",
      "rect": [
        760,
        100,
        480,
        480
      ],
      "polygons": [
        [
          [
            892,
            311
          ],
          [
            901,
            307
          ],
          [
            914,
            303
          ],
          [
            927,
            303
          ],
          [
            936,
            307
          ],
          [
            940,
            314
          ],
          [
            943,
            319
          ],
          [
            940,
            326
          ],
          [
            940,
            336
          ],
          [
            936,
            342
          ],
          [
            918,
            343
          ],
          [
            905,
            340
          ],
          [
            897,
            334
          ],
          [
            890,
            323
          ],
          [
            885,
            322
          ],
          [
            888,
            316
          ]
        ],
        [
          [
            985,
            313
          ],
          [
            997,
            312
          ],
          [
            1007,
            317
          ],
          [
            1021,
            321
          ],
          [
            1033,
            326
          ],
          [
            1043,
            327
          ],
          [
            1040,
            334
          ],
          [
            1049,
            343
          ],
          [
            1043,
            348
          ],
          [
            1032,
            351
          ],
          [
            1025,
            357
          ],
          [
            1015,
            359
          ],
          [
            1004,
            356
          ],
          [
            994,
            353
          ],
          [
            989,
            344
          ],
          [
            987,
            334
          ],
          [
            986,
            326
          ],
          [
            980,
            325
          ]
        ],
        [
          [
            902,
            301
          ],
          [
            911,
            296
          ],
          [
            925,
            295
          ],
          [
            934,
            297
          ],
          [
            935,
            301
          ],
          [
            925,
            299
          ],
          [
            914,
            300
          ],
          [
            905,
            304
          ]
        ],
        [
          [
            991,
            303
          ],
          [
            1005,
            307
          ],
          [
            1017,
            313
          ],
          [
            1026,
            320
          ],
          [
            1029,
            324
          ],
          [
            1023,
            321
          ],
          [
            1013,
            315
          ],
          [
            1003,
            311
          ],
          [
            990,
            308
          ]
        ],
        [
          [
            949,
            389
          ],
          [
            953,
            388
          ],
          [
            958,
            391
          ],
          [
            961,
            394
          ],
          [
            960,
            397
          ],
          [
            953,
            397
          ],
          [
            947,
            395
          ],
          [
            947,
            392
          ]
        ]
      ]
    },
    {
      "target": "leftwhite",
      "source": "whiteplate",
      "crop": [
        0,
        0,
        966.5,
        813
      ],
      "rect": [
        886,
        291,
        89,
        75
      ],
      "polygons": [
        [
          [
            914,
            314
          ],
          [
            922,
            311
          ],
          [
            931,
            313
          ],
          [
            938,
            318
          ],
          [
            940,
            325
          ],
          [
            938,
            335
          ],
          [
            935,
            341
          ],
          [
            920,
            341
          ],
          [
            914,
            336
          ],
          [
            911,
            328
          ],
          [
            911,
            320
          ]
        ]
      ]
    },
    {
      "target": "rightwhite",
      "source": "whiteplate",
      "crop": [
        966.5,
        0,
        1933,
        813
      ],
      "rect": [
        973,
        306,
        89,
        75
      ],
      "polygons": [
        [
          [
            998,
            323
          ],
          [
            1007,
            324
          ],
          [
            1018,
            327
          ],
          [
            1027,
            332
          ],
          [
            1033,
            338
          ],
          [
            1029,
            347
          ],
          [
            1022,
            355
          ],
          [
            1013,
            357
          ],
          [
            1001,
            352
          ],
          [
            995,
            347
          ],
          [
            993,
            339
          ],
          [
            994,
            330
          ]
        ]
      ]
    }
  ],
  "atlas_size": 4096,
  "pixels_per_unit": 1253,
  "layers": [
    {
      "id": "HitAreaBody",
      "source": "mask",
      "rect": [
        760,
        430,
        560,
        670
      ],
      "mesh": [
        1,
        1
      ],
      "opacity": 0,
      "neutral_opacity": 0,
      "group": "all"
    },
    {
      "id": "HitAreaHead",
      "source": "mask",
      "rect": [
        800,
        150,
        380,
        300
      ],
      "mesh": [
        1,
        1
      ],
      "opacity": 0,
      "neutral_opacity": 0,
      "group": "all"
    },
    {
      "id": "EyeApertureLeft",
      "source": "mask",
      "rect": [
        881,
        299,
        66,
        48
      ],
      "mesh": [
        2,
        2
      ],
      "group": "all",
      "neutral_opacity": 0,
      "effects": {
        "ParamEyeLOpen": {
          "type": "aperture",
          "pivot": [
            923,
            342
          ],
          "points": [
            [
              0,
              0.001
            ],
            [
              0.25,
              0.25
            ],
            [
              0.65,
              0.65
            ],
            [
              1,
              1
            ],
            [
              1.15,
              1.15
            ]
          ]
        }
      }
    },
    {
      "id": "EyeApertureRight",
      "source": "mask",
      "rect": [
        976,
        308,
        77,
        55
      ],
      "mesh": [
        2,
        2
      ],
      "group": "all",
      "neutral_opacity": 0,
      "effects": {
        "ParamEyeROpen": {
          "type": "aperture",
          "pivot": [
            1017,
            357
          ],
          "points": [
            [
              0,
              0.001
            ],
            [
              0.25,
              0.25
            ],
            [
              0.65,
              0.65
            ],
            [
              1,
              1
            ],
            [
              1.15,
              1.15
            ]
          ]
        }
      }
    },
    {
      "id": "Base",
      "source": "base",
      "rect": [
        0,
        0,
        2347,
        1253
      ],
      "mesh": [
        40,
        28
      ],
      "group": "all"
    },
    {
      "id": "EyeLeft",
      "source": "leftwhite",
      "polygon": [
        [
          892,
          311
        ],
        [
          901,
          307
        ],
        [
          914,
          303
        ],
        [
          927,
          303
        ],
        [
          936,
          307
        ],
        [
          940,
          314
        ],
        [
          943,
          319
        ],
        [
          940,
          326
        ],
        [
          940,
          336
        ],
        [
          936,
          342
        ],
        [
          918,
          343
        ],
        [
          905,
          340
        ],
        [
          897,
          334
        ],
        [
          890,
          323
        ],
        [
          885,
          322
        ],
        [
          888,
          316
        ]
      ],
      "mesh": [
        8,
        6
      ],
      "group": "all",
      "masks": [